task_id,task_name,primary_skill,secondary_skill,complexity_level,estimated_hours,required_experience,team_size,dependencies,critical_path,resource_notes,alternative_approach
WI-TEST-005,"E2E Uninstaller Testing",Quality Assurance,DevOps,Low,2.7,Mid,1,"US-006,TASK-INFRA-010,TASK-INFRA-012",Yes,"Manual testing task to verify all uninstallation paths on clean virtual machines.","Assume the Inno Setup script works as intended without testing. This is risky as misconfigurations could lead to incomplete uninstalls."
WI-INFRA-013,"Develop Version Check Service",Backend Development,N/A,Medium,6.2,Mid,1,"US-067",No,"Requires a C# developer to implement an asynchronous web request with proper error handling for network issues.",Hard-code the download URL into a button and never check for updates. The user would have to manually discover that a new version exists.
WI-UI-005,"Create Main Menu Update Notification UI",Frontend Development,Design,Medium,4.2,Mid,1,"US-067,TASK-UI-001",No,"Standard UI task to create a non-intrusive banner or badge element.",Use a blocking modal dialog on startup to announce an update. This is intrusive and a poor user experience.
WI-INFRA-014,"Integrate Update Check into Main Menu Startup",Backend Development,Frontend Development,Medium,4.7,Mid,1,"US-067,TASK-INFRA-013,TASK-INFRA-014",No,"Integration task to connect the backend service with the frontend UI element.",Perform the update check synchronously on the main thread. This would cause the application to freeze on startup until the web request completes or times out.
WI-GSTATE-005,"Implement SQLite Repository and Schema Setup",Backend Development,N/A,High,9.3,Senior,1,"EPIC-GSTATE-DB",Yes,"Foundational data persistence task. Requires a senior developer with database design and C#/SQLite experience.",Store all player statistics in a flat JSON file. This is not scalable, is inefficient to query, and is prone to corruption.
WI-GSTATE-006,"Implement Statistics Update and High Score Logic",Backend Development,N/A,High,12,Senior,1,"EPIC-GSTATE-DB,TASK-GSTATE-009",Yes,"Complex database logic requiring transactional updates to maintain data integrity. The Top 10 logic involves a conditional insert/delete.",Read the entire stats file, update it in memory, and write it back out. This is not transactional and can lead to data loss if it fails mid-write.
WI-GSTATE-007,"Implement Database Backup and Recovery Logic",Backend Development,DevOps,High,10.3,Senior,1,"EPIC-GSTATE-DB,TASK-GSTATE-009",Yes,"Complex, high-risk logic for data resilience. Requires careful file I/O and error handling to prevent making a bad situation worse. (See RISK-012)",Provide no backup mechanism. If the database becomes corrupted, the user loses all their historical progress permanently.
WI-TEST-006,"Write Initial Suite of Core Logic Unit Tests",Quality Assurance,Backend Development,High,10.2,Mid,1,"EPIC-INFRA-SETUP,TASK-INFRA-016,TASK-CORE-005,TASK-CORE-044",Yes,"Represents the ongoing effort of the QA team to build out the unit test suite in parallel with development to meet the 70% coverage requirement.",Delay all unit testing until the end of the project. This is a very poor practice that leads to low-quality code and a difficult, buggy integration phase.