story_id,epic,title,user_role,description,priority,story_points,dependencies,acceptance_criteria_1,acceptance_criteria_2,acceptance_criteria_3,technical_tasks,definition_of_done
US-044,EPIC-CORE,"Automatically collect rent when an opponent lands on my property","Property Owner","As a property owner, I want the game to automatically calculate and transfer the correct rent from an opponent who lands on my property so that the game rules are enforced fairly.",Must Have,5,"US-016, US-030, US-038, US-033","Given Player A owns 'Baltic Avenue' (unmortgaged, undeveloped), When Player B lands on 'Baltic Avenue', Then the base rent is automatically transferred from Player B to Player A.","Given Player A owns the magenta monopoly (undeveloped, unmortgaged), When Player B lands on 'Virginia Avenue', Then double the base rent is transferred from Player B to Player A.","Given Player A owns 'Indiana Avenue' and it is currently mortgaged, When Player B lands on 'Indiana Avenue', Then no rent is collected.",WI-CORE-003,"All acceptance criteria validated and passing. Unit test coverage for the rent calculation module exceeds 85%. Integration test confirms the flow from landing to cash transfer and HUD update. The trigger for the bankruptcy module is tested."
US-045,EPIC-CORE,"Automatically pay rent when I land on an opponent's property","Player","As a player, I want the game to automatically calculate and process my rent payment when I land on an opponent's property, so that the game flows smoothly and the rules are enforced correctly.",Must Have,5,"US-016, US-030, US-033, US-038, US-047","Given I land on an opponent's property with houses and can afford the rent, When my movement ends, Then my cash is automatically reduced by the correct rent amount, the opponent's cash increases, and a notification confirms the payment.","Given I land on an opponent's mortgaged property, When my movement ends, Then no rent is charged, my cash remains unchanged, and a notification indicates no rent is due.","Given I have insufficient cash to pay the rent, When the payment is triggered, Then the system identifies I cannot pay and initiates the bankruptcy process.",WI-CORE-003,"All acceptance criteria validated and passing. Unit tests for the rent calculation logic cover all property types and rule variations. Integration testing confirms the correct interaction between movement, rent payment, UI updates, and the bankruptcy trigger."
US-046,EPIC-CORE,"See a victory screen when I am the last player remaining","Human Player","As a human player who has won the game, I want to be presented with a distinct and celebratory victory screen, so that my achievement is acknowledged and I feel a sense of accomplishment.",Must Have,5,"US-011, US-047, US-048, US-064","Given a game is in progress, When the last AI opponent is declared bankrupt, making the human player the sole winner, Then the main game view is replaced by a modal Victory Screen.","Given the Victory Screen is displayed, When the player views the screen, Then it must display a 'Victory!' message, the player's profile name, Final Net Worth, Game Duration, and Total Turns from the match.","Given the Victory Screen is displayed, When the screen first appears, Then a victory fanfare audio clip plays and celebratory visual effects (e.g., confetti) are rendered.",WI-CORE-011,"All acceptance criteria validated and passing. Integration testing for the bankruptcy-to-victory-screen flow is completed successfully. Performance on recommended hardware is verified. Visual and audio assets are implemented and linked to the theme system."
US-047,EPIC-CORE,"See a game-over screen when I go bankrupt","Human Player","As a human player, I want to be shown a clear 'Game Over' screen immediately after I am declared bankrupt, so that I understand I have lost the game.",Must Have,5,"US-045, US-038, US-048","Given the human player incurs a debt they cannot pay after liquidating all assets, When the system declares them bankrupt, Then the main game view is immediately replaced by a modal 'Game Over' screen.","Given the player is viewing the 'Game Over' screen, When they click the 'View Game Summary' button, Then a high-speed simulation of the remaining AI players' turns begins until a single AI winner is determined.","Given the high-speed AI simulation is running, When the simulation concludes with a single AI winner, Then the game automatically transitions to the final 'Game Summary' screen.",WI-CORE-011,"All acceptance criteria validated and passing. The high-speed AI simulation is verified to complete correctly and without performance degradation. The UI/UX for the 'Game Over' screen and simulation indicator has been reviewed and approved."
US-048,EPIC-CORE,"View a detailed game summary screen after a match ends","Human Player","As a Human Player who has just completed a game, I want to be shown a detailed game summary screen so that I can review the performance of all players and understand the final outcome.",Should Have,5,"US-046, US-047, US-013","Given a game has concluded with a human win, When the Game Summary screen is displayed, Then a 'Victory!' message is shown, the human player is highlighted as the winner, and stats are shown for all players.","Given a game has concluded with a human loss, When the Game Summary screen is displayed, Then a 'Game Over' message is shown, the final winning AI is highlighted, and stats are shown for all players.","Given the Game Summary screen is displayed, When the user reviews the stats, Then the values for 'Final Net Worth', 'Total Rent Collected', and 'Properties Owned' must accurately reflect the final state of the game.",WI-UI-007,"All acceptance criteria validated and passing. Integration testing for the game-end-to-summary-screen flow is completed successfully. The UI is reviewed and approved for all player counts (2-4). The high-speed AI simulation from US-047 correctly leads to this screen."
US-049,EPIC-UI,"View at-a-glance information for all players in the HUD","Player","As a player, I want a persistent on-screen display showing the name, token, and current cash for every player, so that I can instantly assess the financial standing of my opponents and myself.",Must Have,3,"US-009, US-011, US-014","Given a new 4-player game has started, When the main game board scene is loaded, Then a persistent HUD is visible with four panels, each correctly displaying the player's name, token icon, and starting cash of $1500.","Given a game is in progress and it is Player 1's turn, When the player views the game screen, Then Player 1's panel in the HUD has a distinct visual highlight.","Given a player has a cash balance of $1000 displayed in the HUD, When the player passes GO and collects a $200 salary, Then the player's cash display in the HUD immediately updates to show $1200.",WI-UI-003,"All acceptance criteria validated and passing. Integration testing confirms HUD updates from game events. The HUD layout is confirmed to work on all target aspect ratios."
US-050,EPIC-UI,"See clear visual indicators of property ownership on the board","Player","As a player, I want clear, player-specific visual indicators on each property space on the board so that I can instantly understand who owns what, identify monopolies, and make faster strategic decisions.",Must Have,5,"US-030, US-038, US-040, US-047","Given a property on the board is unowned, When a player purchases that property, Then a visual indicator corresponding to the purchasing player's unique color/token immediately appears on the property space.","Given a player owns a property, When the player mortgages that property, Then the ownership indicator's visual state changes to clearly signify it is mortgaged (e.g., becomes greyed-out) while still being identifiable.","Given Player A owns Property X and Player B owns Property Y, When they complete a trade exchanging ownership, Then the marker on Property X immediately updates to Player B's ownership, and the marker on Property Y updates to Player A's ownership.",WI-CORE-003,"All acceptance criteria validated and passing. Integration testing completed for all trigger events (purchase, trade, mortgage, bankruptcy). Performance requirements verified under a fully populated board scenario. Accessibility requirement for non-color-based indicators is met."
US-051,EPIC-UI,"Interact with modal dialogs for critical decisions","Human Player","As a human player, I want the game to pause and display a focused, interactive pop-up for critical decisions, so that I can consciously evaluate my options without the risk of missing important game events.",Must Have,5,"US-030, US-041, US-026","Given I am the human player, When I land on an unowned property, Then the game pauses and a modal dialog is displayed showing the property's info with 'Buy' and 'Auction' buttons.","Given an AI opponent has proposed a trade, When the offer is presented to me, Then the game pauses and a modal dialog displays the offered/requested assets with 'Accept', 'Decline', and 'Propose Counter-Offer' buttons.","Given any critical decision modal dialog is active on screen, When I attempt to click on any UI element outside of the dialog, Then the clicks are ignored, and only interactions inside the modal are registered.",WI-UI-004,"All acceptance criteria validated and passing. A reusable modal dialog prefab and controller have been created. The modal system is successfully integrated for property purchase, trade response, and income tax scenarios. The UI has been reviewed for visual polish and usability."
US-052,EPIC-UI,"Access a dedicated interface to manage all my properties","Human Player","As a human player managing my assets, I want to access a dedicated property management screen so that I can efficiently view my properties and take strategic actions like building or mortgaging from a single interface.",Must Have,5,"US-029, US-033, US-038","Given it is my turn, before I have rolled the dice, When I click the 'Manage Properties' button in the main HUD, Then a dedicated property management screen is displayed, overlaying the main game board.","Given I own a complete, undeveloped monopoly and have sufficient cash, When I select a property from that monopoly and click the 'Build House' button, Then my cash is debited by the correct building cost and the UI updates immediately.","Given I own a monopoly where one property has 1 house and the others have 0, When I select the property that already has 1 house, Then the 'Build House' button for that property is disabled, and a tooltip explains that building must be even.",WI-UI-005,"All acceptance criteria validated and passing. Unit test coverage for UI logic and state validation meets the project standard. Integration tests for all property management actions are implemented and passing. The UI has been reviewed and approved by a UX/UI designer."
US-053,EPIC-UI,"Use a two-panel interface to build and review trade offers","Human Player","As a Human Player, I want a clear, two-panel trading interface that displays my items and the opponent's items side-by-side so that I can easily construct, review, and understand trade offers.",Must Have,8,"US-040, US-041, US-042","Given it is my turn, When I select an AI opponent and choose to 'Trade', Then a modal interface appears with two panels: 'Your Offer' and 'Their Offer', showing available assets for selection.","Given the trading interface is open, When I add my property and cash to 'Your Offer' and add an AI's property to 'Their Offer', Then all selected items appear in their respective panels, and the 'Propose Trade' button becomes enabled.","Given an AI opponent initiates a trade with me, When the offer is presented, Then the same two-panel interface appears, pre-populated with the AI's offer, and displays 'Accept', 'Decline', and 'Propose Counter-Offer' buttons.",WI-UI-006,"All acceptance criteria validated and passing. The trading UI has been manually tested for all scenarios, including error conditions and edge cases. The UI has been reviewed by a UX/UI designer and approved. All UI elements are functional across all supported resolutions."
US-054,EPIC-UI,"Access an in-game settings menu","Player","As a player in the middle of a game, I want to access a settings menu without quitting the match, so that I can adjust game options, save my progress, or exit the game in a controlled manner.",Must Have,5,US-049,"Given a game is in progress and it is my turn, When I press the 'Escape' key, Then a settings menu overlay appears and the game simulation is paused.","Given the settings menu is open, When I press the 'Escape' key again or click the 'Resume Game' button, Then the menu is closed and the game simulation resumes from its exact previous state.","Given the in-game settings menu is open, When I view the menu, Then it must contain distinct, clickable options for 'Resume Game', 'Settings', 'Save Game', 'Load Game', 'Return to Main Menu', and 'Quit to Desktop'.",WI-UI-001,"All acceptance criteria validated and passing. Unit tests for the pause/resume logic are implemented with >80% coverage. Integration testing for opening/closing the menu in various game states is completed successfully. This story is a blocker for numerous other settings-related stories."
US-055,EPIC-UI,"Adjust the game speed to make animations faster or instant","Experienced Player","As an experienced player, I want to change the game speed setting so that I can reduce waiting times for animations and AI decisions, allowing for a faster-paced game.",Should Have,5,"US-054, US-061, US-062","Given I am in a game, When I navigate to the settings menu and select the 'Fast' game speed option, Then all subsequent game animations play at an accelerated rate and AI decision delays are reduced.","Given I am in a game, When I navigate to the settings menu and select the 'Instant' game speed option, Then all subsequent game animations are skipped or rendered almost instantaneously, and AI decisions have no artificial delay.","Given the game speed is set to 'Fast' or 'Instant' and I am involved in a property auction, When the auction begins, Then the game speed is automatically and temporarily set to 'Normal' for the duration of the auction.",WI-UI-001,"All acceptance criteria validated and passing. Manual E2E testing confirms a smooth and consistent experience on all speed settings. The auction override logic is tested and verified. The setting is correctly saved and loaded with a game file."
US-056,EPIC-UI,"Adjust master, music, and sound effect volumes independently","Player","As a player, I want to independently adjust the master, music, and sound effect volume levels so that I can customize the game's audio to my personal preference.",Must Have,3,US-054,"Given I am in the settings menu and background music is playing, When I move the 'Music' volume slider, Then the volume of the background music changes in real-time to match the slider's value.","Given I am in the settings menu, When I move the 'Sound Effects' volume slider, Then a sample sound effect is played at the new volume level, and the new setting is immediately persisted.","Given I have set the Music volume to 30%, When I close the game completely and then relaunch it, Then the game's music volume is at 30% and the slider in the settings menu reflects this saved value.",WI-UI-001,"All acceptance criteria validated and passing. Integration testing confirms UI sliders correctly manipulate the audio mixer. All existing game audio sources have been audited and correctly routed to the Music or SFX channel. Settings persist between sessions."
US-057,EPIC-GSTATE,"Reset all my historical statistics and high scores","Data-Conscious Player","As a Data-Conscious Player, I want an option in the settings menu to permanently delete all my historical gameplay statistics and high scores after a confirmation prompt, so that I can have a clean slate.",Could Have,2,"US-013, US-064, US-054","Given I have existing historical statistics, When I navigate to settings, click 'Reset All Player Data', and click 'Confirm' on the dialog, Then all my historical stats are reset to their default zero state, and my high scores list is empty.","Given I have existing stats, When I click 'Reset All Player Data' and then click 'Cancel' on the confirmation dialog, Then no data is modified or deleted.","Given I am in the settings menu, When I click the 'Reset All Player Data' button, Then a modal confirmation dialog appears with text clearly stating the action is permanent and cannot be undone.",WI-UI-001,"All acceptance criteria validated and passing. Integration testing completed to verify database transaction integrity. The UI for the button and dialog has been reviewed for clarity and usability. The feature works correctly for a profile with no pre-existing data."
US-058,EPIC-UI,"Provide a bulk deletion option for all saved games via the settings menu","System-Conscious Player","As a user who wants to manage my game data, I want an option in the settings menu to delete all my saved games at once, with a confirmation step, so that I can easily clear out old progress.",Could Have,1,"US-054, US-061","Given I have at least one saved game file, When I click 'Delete All Saved Games' in settings and 'Confirm' on the dialog, Then all files within the '%APPDATA%/MonopolyTycoon/saves' directory are permanently deleted.","Given I have opened the deletion confirmation dialog, When I click the 'Cancel' button, Then the dialog closes and no files are deleted.","Given I have no saved game files, When I navigate to the settings menu, Then the 'Delete All Saved Games' button is visibly disabled and cannot be clicked.",WI-UI-001,"All acceptance criteria validated and passing. Error handling for file system exceptions is implemented and verified. The UI for the button and dialog has been reviewed and approved for clarity."
US-059,EPIC-UI,"Start an optional interactive tutorial to learn the game","New Player","As a new player, I want to start an optional, interactive tutorial so that I can learn the basic rules and game controls in a guided, hands-on environment before playing a full game.",Should Have,8,"US-008, US-015, US-030, US-044, US-049","Given the tutorial has started, When it prompts me to roll the dice by highlighting the 'Roll' button, Then all other UI elements are non-interactive, and the dice animate a pre-determined roll result.","Given my token has landed on an unowned property as part of the script, When the purchase dialog appears, Then the tutorial highlights the 'Buy' button with an explanatory overlay, and clicking it deducts the cost and grants ownership.","Given I have completed the final guided action, When the final action is confirmed, Then a 'Tutorial Complete' dialog is displayed with options to 'Start New Game' or 'Return to Main Menu'.","WI-UI-001","All acceptance criteria validated and passing. A full, successful manual end-to-end test of the tutorial has been completed. The tutorial script is data-driven, not hardcoded. The user can exit the tutorial cleanly at any step."
US-060,EPIC-UI,"Access and search a digital rulebook from game menus","Player","As a player, I want to open a searchable digital rulebook from both the main menu and the in-game pause menu so that I can quickly find and clarify specific game rules.",Should Have,5,"US-054, US-008","Given the rulebook UI is open, When I type a keyword (e.g., 'mortgage') into the search bar, Then the list of rules is dynamically filtered to show only entries containing 'mortgage', and the keyword is highlighted.","Given I have opened the rulebook from the in-game pause menu, When I click the 'Close' button or press 'Escape', Then the rulebook UI closes and I am returned to the pause menu, with the game remaining paused.","Given the rulebook's source JSON file is missing or malformed, When I attempt to open the rulebook, Then a user-friendly error message is displayed, the UI does not open, and an ERROR is written to the log file.",WI-UI-001,"All acceptance criteria validated and passing. Performance requirements for search speed and UI loading are verified. Error handling for missing/corrupt data file is confirmed to work. Rulebook content is loaded from an external file."
US-061,EPIC-GSTATE,"Save game progress into one of several save slots","Player","As a player, I want to save my current game progress into a specific save slot at the start of my turn, so that I can safely exit the game and resume playing from the same point at a later time.",Must Have,5,"US-054, WI-CORE-001","Given it is my turn, before I have rolled the dice, When I open the pause menu, select 'Save Game', and click on an 'Empty' save slot, Then the complete current GameState is serialized into a versioned JSON file in '%APPDATA%/MonopolyTycoon/saves'.","Given I am in the 'Save Game' menu and click on a used slot, When a confirmation dialog appears to overwrite the save and I select 'Yes', Then the existing save file is replaced with the new game state data.","Given it is an AI player's turn OR it is my turn but after I have rolled the dice, When I open the pause menu, Then the 'Save Game' button is visually disabled and is not clickable.",WI-GSTATE-001,"All acceptance criteria validated and passing. An E2E test of saving and successfully reloading (using US-062 functionality) has been completed. The save operation performance is confirmed to be under the 2-second threshold. The save file includes a version and checksum."
US-062,EPIC-GSTATE,"Load a game from a previously saved slot","Returning Player","As a returning player, I want to select and load a previously saved game from the main menu, so that I can seamlessly continue my progress without having to start over.",Must Have,5,"US-061, US-063","Given I am on the main menu and have a valid saved game, When I navigate to the 'Load Game' screen, select the valid slot, and confirm, Then the game transitions to the gameplay scene, and the entire game state is perfectly restored.","Given I am on the 'Load Game' screen, When the list of slots is displayed, Then each occupied and valid slot must display the player's profile name, the date and time of the save, and the turn number.","Given a save file has failed its checksum validation, When the 'Load Game' screen is displayed, Then the slot for the corrupted file is marked as 'Corrupted' or 'Unusable' and is disabled.",WI-GSTATE-002,"All acceptance criteria validated and passing. Performance requirement for load time is verified. All error conditions (corruption, incompatibility, no files) are handled gracefully. A full save-load-verify cycle test with a complex game state is completed successfully."
US-063,EPIC-GSTATE,"Visually indicate unusable save files on the load game screen","Returning Player","As a Returning Player, I want to see a clear, visual indication for any save files that are corrupted or incompatible, so that I can understand which games I can no longer play and avoid loading a broken save.",Must Have,5,"US-061, US-062","Given a save file exists whose content does not match its stored checksum, When the player navigates to the 'Load Game' screen, Then the entry for that slot is visually distinct (e.g., greyed out) and clearly labeled as 'Corrupted'.","Given a save slot is marked as 'Corrupted', When the player hovers the mouse cursor over it, Then a tooltip appears with an informative message, such as 'This save file is corrupted and cannot be loaded.'","Given a valid save file exists that was created with an older, incompatible version of the game, When the player navigates to the 'Load Game' screen, Then the entry for that slot is visually distinct and clearly labeled as 'Incompatible Version', and the 'Load' button is disabled.",WI-GSTATE-002,"All acceptance criteria validated and passing. The application remains stable when presented with malformed or invalid save files. Unit tests for checksum validation and version comparison are implemented. The UI is reviewed for clarity."
US-064,EPIC-GSTATE,"View a list of my top 10 victories","Competitive Player","As a competitive player, I want to access a Top 10 High Score screen from the main menu, so that I can review my most successful victories and be motivated to beat my own records.",Should Have,2,"US-011, US-046, US-048","Given the player has won 10 or more games, When they select 'Top Scores' from the main menu, Then a screen is displayed showing a list of exactly 10 entries, sorted by Final Net Worth (descending).","Given the player has won 4 games, When they navigate to the 'Top Scores' screen, Then the list displays exactly 4 entries, sorted correctly.","Given the database contains two victories with the exact same Final Net Worth, but one was achieved in fewer turns, When the player views the 'Top Scores' screen, Then the victory with fewer turns is ranked higher.",WI-GSTATE-003; WI-GSTATE-004,"All acceptance criteria validated and passing. Performance requirement of <500ms load time is verified. The feature is successfully tested against an empty, partially full, and full database. Sorting logic for primary and secondary keys is verified."
