story_id,epic,title,user_role,description,priority,story_points,dependencies,"acceptance_criteria_1","acceptance_criteria_2","acceptance_criteria_3",technical_tasks,definition_of_done
US-040,Property & Economic System,"Initiate a trade with an AI opponent during my turn","As a human player, I want to open a trading interface and construct a trade offer, so that I can strategically negotiate to acquire properties I need to complete monopolies.",Must Have,5,"US-052, US-053","Given it is the human player's turn, during the Pre-Roll Management Phase, when the player opens the trade interface, selects an AI opponent, constructs an offer, and clicks 'Propose Trade', then the trade proposal is submitted to the selected AI's decision-making module for evaluation.","Given the human player owns a property that has one or more houses on it, when the player opens the trade interface, then the developed property is not available for selection in the trade UI, or it is visually disabled.","Given the human player has $500 cash, when the player attempts to enter an amount greater than $500 in the cash offer field, then the UI prevents the input or caps the value at $500, and the 'Propose Trade' button is disabled.",WI-502-003: Develop Property Management and Trading Interfaces,"All acceptance criteria met. Trade initiation and offer construction are fully functional. Business rule validation (no developed properties, sufficient cash) is implemented in the UI."
US-041,Property & Economic System,"Respond to a trade offer from an AI opponent","As a human player, I want to be presented with a clear, interactive dialog when an AI opponent proposes a trade, so that I can evaluate the deal and decide to accept or decline it.",Must Have,5,"US-053, US-040, US-032","Given an AI opponent has initiated a trade proposal, when the system presents the offer, then the game flow is paused and a modal dialog is displayed, showing the offered/requested assets and buttons for 'Accept', 'Decline', and 'Propose Counter-Offer'.","Given the trade offer dialog is displayed, when the human player clicks the 'Accept' button, then the system re-validates the trade, exchanges the assets atomically, closes the dialog, and displays a success notification.","Given the trade offer dialog is displayed, when the human player clicks the 'Decline' button, then the trade dialog closes immediately, no assets are exchanged, and the game flow resumes.",WI-502-003: Develop Property Management and Trading Interfaces,"All acceptance criteria met. AI-initiated trade dialog is implemented. Accept and Decline logic is fully functional and tested. Asset exchange is atomic."
US-042,Property & Economic System,"Propose a counter-offer to an AI's trade proposal","As a strategic player negotiating with an AI, I want to respond to their trade proposal with a modified counter-offer, so that I can fine-tune the deal to better suit my strategic goals.",Should Have,5,"US-041, US-053","Given an AI has proposed a trade, when the player clicks the 'Propose Counter-Offer' button, then the trade proposal dialog closes, and the main two-panel trading UI opens, pre-populated with the AI's original offer.","Given the player has opened the counter-offer UI and modified the trade, when the player submits the counter-offer, then the AI's evaluation logic is triggered, the AI responds (accepts or declines), a notification confirms the outcome, and assets are exchanged only if accepted.","Given the player has opened the counter-offer UI, when the player clicks the 'Cancel' button without submitting a new offer, then the trading UI closes, the original trade offer is considered declined, and the game returns to its prior state.",WI-502-003: Develop Property Management and Trading Interfaces,"All acceptance criteria met. Counter-offer button correctly transitions to the main trading UI. UI is pre-populated correctly. AI response logic is integrated."
US-043,Presentation & User Interface (UI),"Receive a non-intrusive notification when AI players trade with each other","As a human player, I want to see a non-intrusive notification when a trade is completed between two AI opponents, so that I can maintain situational awareness of the game's strategic landscape.",Should Have,2,"US-040, US-010","Given a game is in progress with a human player and two AI opponents, when AI 1 successfully completes a trade with AI 2, exchanging 'Boardwalk' for $500, then a notification banner appears on the screen with the text 'Trade Complete: AI 1 traded Boardwalk to AI 2 for $500'.","Given a game is in progress, when AI 1 proposes a trade to AI 2, and AI 2 rejects the offer, then no trade notification is displayed to the human player.","Given the player has set the 'Game Speed' to 'Instant', when two AI players complete a trade, then the trade notification is still displayed for its full, standard duration.",WI-401-003: Develop AI Decision Logic Nodes,"All acceptance criteria met. Notification system is integrated with the AI trading logic. Notifications are non-intrusive, accurate, and respect game speed settings for visibility."
US-044,Property & Economic System,"Automatically collect rent when an opponent lands on my property",As a property owner, I want the game to automatically calculate and transfer the correct rent from an opponent who lands on my property so that the game rules are enforced fairly.,Must Have,5,"US-016, US-030, US-038, US-033, US-047","Given Player A owns 'Baltic Avenue' (but not 'Mediterranean Avenue') and it is not mortgaged, when Player B lands on 'Baltic Avenue', then the base rent for 'Baltic Avenue' ($4) is automatically deducted from Player B's cash and added to Player A's cash.","Given Player A owns 'St. Charles Place', 'States Avenue', and 'Virginia Avenue' (a monopoly), and none have houses or are mortgaged, when Player B lands on 'Virginia Avenue', then the rent, which is double the base rent ($20), is automatically transferred from Player B to Player A.","Given Player A owns 'Indiana Avenue' and it is currently mortgaged, when Player B lands on 'Indiana Avenue', then no rent is collected, and no cash is transferred between players.",WI-301-002: Implement Rent Collection Logic,"All acceptance criteria met. Rent calculation logic is unit tested for all property types and states (standard, monopoly, developed, railroad, utility, mortgaged). Integration with bankruptcy system is verified."
US-045,Core Gameplay Engine & Rule Implementation,"Automatically pay rent when I land on an opponent's property","As a player, I want the game to automatically calculate and process my rent payment when I land on an opponent's property, so that the game flows smoothly and the rules are enforced correctly.",Must Have,5,"US-016, US-030, US-033, US-038, US-047","Given I am a player with $1000 cash and an AI owns Illinois Avenue with 3 houses (rent $750), when my token's movement ends on Illinois Avenue, then my cash is automatically reduced to $250 and the AI's cash increases by $750.","Given an AI opponent owns both Utilities and my last dice roll was a total of 9, when my token's movement ends on Water Works, then the rent is calculated as 10 times the dice roll (10 * 9 = $90) and deducted from my cash.","Given I am a player with $50 cash and no mortgagable assets, and I land on an opponent's property where the rent is $100, when the rent payment is triggered, then the system identifies I cannot pay the debt and initiates the bankruptcy process.",WI-301-002: Implement Rent Collection Logic,"All acceptance criteria met. Rent payment is automatic and accurate for all property types. Integration with UI for feedback is complete. Bankruptcy trigger is verified."
US-046,Property & Economic System,"See a victory screen when I am the last player remaining","As a human player who has won the game, I want to be presented with a distinct and celebratory victory screen, so that my achievement is acknowledged and I feel a sense of accomplishment.",Must Have,5,"US-011, US-047, US-048, US-064, US-066","Given a game is in progress, when the last AI opponent is declared bankrupt, making the human player the sole remaining participant, then the main game view is immediately replaced by a modal Victory Screen.","Given the Victory Screen is displayed, when the player views the screen, then the screen must display a prominent 'Victory!' message, the player's profile name, and key statistics like Final Net Worth and Game Duration.","Given the Victory Screen is displayed, when the screen first appears, then a victory fanfare audio clip plays and celebratory visual effects (e.g., confetti) are rendered.",WI-303-001: Implement Bankruptcy Detection and Asset Transfer,"All acceptance criteria met. Win condition correctly triggers the victory screen. Screen displays accurate stats and celebratory effects. Navigation to other screens is functional."
US-047,Property & Economic System,"See a game-over screen when I go bankrupt","As a human player, I want to be shown a clear 'Game Over' screen immediately after I am declared bankrupt, so that I understand I have lost the game.",Must Have,5,"US-045, US-038, US-048","Given the human player incurs a debt they cannot pay after liquidating all assets, when the system declares the player bankrupt, then the main game view is immediately replaced by a modal 'Game Over' screen.","Given the 'Game Over' screen is displayed, when the player views the screen, then it must contain a prominent header text like 'Game Over' and a single button labeled 'View Game Summary'.","Given the human player is viewing the 'Game Over' screen and more than one AI opponent remains, when the player clicks the 'View Game Summary' button, then a high-speed simulation of the remaining AI players' turns begins until a single AI winner is determined.",WI-303-001: Implement Bankruptcy Detection and Asset Transfer,"All acceptance criteria met. Loss condition correctly triggers the game over screen. The screen contains the correct UI elements. The subsequent high-speed AI simulation is functional."
US-048,Presentation & User Interface (UI),"View a detailed game summary screen after a match ends","As a Human Player who has just completed a game, I want to be shown a detailed game summary screen so that I can review the performance of all players and understand the final outcome.",Must Have,5,"US-046, US-047, US-013","Given a game has concluded with a human victory, when the Game Summary screen is displayed, then a 'Victory!' message is prominently displayed, the human player is highlighted as the winner, and statistics are shown for all players.","Given a game has concluded with a human loss, when the Game Summary screen is displayed, then a 'Game Over' message is displayed, the final winning AI player is highlighted as the winner, and statistics for all players are displayed.","Given the Game Summary screen is displayed, when the user clicks the 'Return to Main Menu' button, then the application navigates to the main menu screen.",WI-303-001: Implement Bankruptcy Detection and Asset Transfer,"All acceptance criteria met. Summary screen displays correct information for both win and loss scenarios. Statistics shown are accurate. Navigation is functional."
US-049,Presentation & User Interface (UI),"View at-a-glance information for all players in the HUD","As a player, I want a persistent on-screen display showing the name, token, and current cash for every player, so that I can instantly assess the financial standing of my opponents and myself.",Must Have,3,"US-009, US-011, US-014","Given a new 4-player game has started, when the main game board scene is loaded, then a persistent Heads-Up Display (HUD) is visible, with four panels each correctly displaying a player's name, token icon, and starting cash of $1500.","Given a game is in progress and it is Player 1's turn, when the player views the game screen, then Player 1's panel in the HUD has a distinct visual highlight (e.g., a glowing border).","Given a player has a cash balance of $1000 displayed in the HUD, when the player passes GO and collects a $200 salary, then the player's cash display in the HUD immediately updates to show $1200.",WI-502-002: Implement In-Game HUD,"All acceptance criteria met. HUD displays correct information for all players. Turn indicator and cash values update in real-time. Layout is responsive."
US-050,Presentation & User Interface (UI),"See clear visual indicators of property ownership on the board","As a player, I want clear, player-specific visual indicators on each property space on the board so that I can instantly understand who owns what and make faster strategic decisions.",Must Have,5,"US-030, US-038, US-040, US-047, US-066","Given a property on the board is unowned, when a player successfully purchases that property, then a visual indicator corresponding to the purchasing player's unique color/token immediately appears on the property space.","Given a player owns a property and its standard ownership indicator is displayed, when the player mortgages that property, then the ownership indicator's visual state changes to clearly signify it is mortgaged (e.g., becomes greyed-out or semi-transparent).","Given Player A owns Property X and Player B owns Property Y, when they complete a trade exchanging ownership, then the marker on Property X immediately updates to show Player B's ownership, and the marker on Property Y updates to show Player A's ownership.",WI-501-001: Implement 3D Game Board and Camera,"All acceptance criteria met. Ownership markers are implemented and correctly reflect the game state after all trigger events (purchase, mortgage, trade, bankruptcy). Indicators are theme-aware."
US-051,Presentation & User Interface (UI),"Interact with modal dialogs for critical decisions","As a human player, I want the game to pause and display a focused, interactive pop-up for critical, turn-halting decisions, so that I can consciously evaluate my options and make informed choices.",Must Have,5,"US-008, US-030, US-041, US-026","Given I am the human player and I land on an unowned property, when my turn is active, then the game's background processes are paused and a modal dialog is displayed showing the property's details and 'Buy'/'Auction' buttons.","Given an AI opponent has proposed a trade, when the trade offer is presented to me, then the game pauses and a modal dialog displays the trade details with 'Accept', 'Decline', and 'Counter-Offer' buttons.","Given any critical decision modal dialog is active on screen, when I attempt to click on any UI element outside of the modal dialog, then the clicks are ignored, and only interactions with the elements inside the modal dialog are registered.",WI-502-003: Develop Property Management and Trading Interfaces,"All acceptance criteria met. A reusable modal dialog system is created and integrated for property purchase, trade response, and tax decisions. Modals correctly pause game flow and block background interaction."
US-052,Presentation & User Interface (UI),"Access a dedicated interface to manage all my properties","As a human player, I want to access a dedicated property management screen so that I can efficiently view my properties and take strategic actions like building or mortgaging from a single interface.",Must Have,8,"US-029, US-032, US-033, US-034, US-038","Given it is the human player's turn, before they have rolled the dice, when the player clicks the 'Manage Properties' button in the main HUD, then a dedicated property management screen is displayed, overlaying the main game board.","Given the player has a complete, undeveloped monopoly and sufficient cash, when the player selects a property from that monopoly and clicks the 'Build House' button, then the player's cash is debited by the correct building cost and the UI updates immediately.","Given the player owns a monopoly where one property has 1 house and the others have 0, when the player selects the property that already has 1 house, then the 'Build House' button for that property is disabled, and an informative tooltip explains that building must be even.",WI-502-003: Develop Property Management and Trading Interfaces,"All acceptance criteria met. The property management UI is fully implemented and accessible at the correct time. All actions (build, sell, mortgage, unmortgage) are available and their UI state is correctly managed by game rules (monopoly required, even building, etc.)."
US-053,Presentation & User Interface (UI),"Use a two-panel interface to build and review trade offers","As a Human Player, I want a clear, two-panel trading interface that displays my items and the opponent's items side-by-side so that I can easily construct, review, and understand trade offers.",Must Have,8,"US-040, US-041, US-042, US-052","Given the trading interface is open, when the player adds one of their properties and enters a cash amount to the 'Your Offer' panel, and adds one of the AI's properties to the 'Their Offer' panel, then all selected items appear correctly in their respective panels.","Given the trading interface is open, and the player owns a property with at least one house, when the player attempts to select the developed property to add to their offer, then the property is visually disabled in the selection list and cannot be added to the offer.","Given an AI opponent initiates a trade, when the trade offer is presented, then the same two-panel interface appears, pre-populated with the AI's offer, and buttons for 'Accept', 'Decline', and 'Propose Counter-Offer' are displayed.",WI-502-003: Develop Property Management and Trading Interfaces,"All acceptance criteria met. The two-panel trading UI is fully functional for player-initiated trades, AI-initiated trades, and counter-offers. All business rule validations are implemented."
US-054,Presentation & User Interface (UI),"Access an in-game settings menu",As a player in the middle of a game, I want to access a settings menu without quitting the match, so that I can adjust game options, save my progress, or exit the game.,Must Have,5,US-023,"Given a game is in progress and it is the human player's turn, when the player presses the 'Escape' key, then the game simulation is paused and a settings menu is displayed as an overlay.","Given the in-game settings menu is open, when the player views the menu, then the menu must contain distinct, clickable options for 'Resume Game', 'Settings', 'Save Game', 'Load Game', 'Return to Main Menu', and 'Quit to Desktop'.","Given a game is in progress and an AI opponent is taking its turn, when the human player opens the settings menu, then the AI's turn is paused, and when the player resumes the game, the AI's turn continues from the exact point it was interrupted.",WI-502-004: Implement Settings Menu,"All acceptance criteria met. The in-game pause/settings menu is implemented and functional. It correctly pauses and resumes the game state for both human and AI turns."
US-055,Presentation & User Interface (UI),"Adjust the game speed to make animations faster or instant","As an experienced player, I want to change the game speed setting so that I can reduce waiting times for animations and AI decisions, allowing for a faster-paced game.",Should Have,5,"US-054, US-026, US-027","Given the player is in a game and the game speed is set to 'Normal', when the player navigates to the settings menu and selects the 'Instant' game speed option, then all subsequent game animations are skipped or rendered almost instantaneously, and AI decisions are processed with no artificial delay.","Given the game speed is set to 'Fast' or 'Instant' and the human player is involved in a property auction, when the auction begins, then the game speed is automatically and temporarily set to 'Normal' for the entire duration of the auction.","Given a player has set the game speed to 'Fast', when the player saves the game, exits, and then loads that saved game, then the game speed setting is correctly restored to 'Fast'.",WI-502-004: Implement Settings Menu,"All acceptance criteria met. Game speed setting is implemented and affects all relevant animations and delays. The auction override logic is functional. The setting is correctly persisted in save games."
US-056,Presentation & User Interface (UI),"Adjust master, music, and sound effect volumes independently","As a player, I want to independently adjust the master, music, and sound effect volume levels so that I can customize the game's audio to my personal preference.",Must Have,3,US-054,"Given the player is in the settings menu and background music is playing, when the player moves the 'Music' volume slider, then the volume of the background music changes in real-time to match the slider's value, and the new setting is immediately persisted.","Given the player is in the settings menu, when the player moves the 'Sound Effects' volume slider, then a sample sound effect is played at the new volume level, and the new setting is immediately persisted.","Given the player has set the Music volume to 30%, when the player closes the game completely and then relaunches it, then the game's audio levels for music are at 30% and the sliders in the settings menu reflect this saved value.",WI-502-004: Implement Settings Menu,"All acceptance criteria met. Three volume sliders are implemented and functional. Changes provide real-time audio feedback. Settings are correctly saved and loaded between sessions."
US-057,Data Persistence & Management,"Reset all my historical statistics and high scores","As a Data-Conscious Player, I want an option in the settings menu to permanently delete all my historical gameplay statistics and high scores, so that I can have a clean slate.",Could Have,2,"US-013, US-064, US-054","Given I have existing historical statistics, when I navigate to the settings menu, click the 'Reset All Player Data' button, and click 'Confirm' on the subsequent confirmation dialog, then all my historical player statistics are reset to their default zero state in the database.","Given I have existing historical statistics, when I click the 'Reset All Player Data' button and then click 'Cancel' on the confirmation dialog, then no data is modified or deleted.","Given I am in the settings menu, when I click the 'Reset All Player Data' button, then a modal confirmation dialog appears with text that explicitly states the action is permanent and cannot be undone.",WI-502-004: Implement Settings Menu,"All acceptance criteria met. Reset button, confirmation dialog, and success notification are implemented. Database transaction is atomic and correctly removes data for the active profile."
US-058,Data Persistence & Management,"Provide a bulk deletion option for all saved games via the settings menu","As a user, I want an option in the settings menu to delete all my saved games at once, so that I can easily clear out old progress without having to manually find and delete files.",Could Have,1,"US-054, US-026","Given the user has at least one saved game file, when the user clicks the 'Delete All Saved Games' button AND clicks 'Confirm' on the subsequent confirmation dialog, then all files within the '%APPDATA%/MonopolyTycoon/saves' directory are permanently deleted.","Given the user has opened the deletion confirmation dialog, when the user clicks the 'Cancel' button, then the confirmation dialog closes AND no files are deleted.","Given the user has no saved game files, when the user navigates to the settings menu, then the 'Delete All Saved Games' button is visibly disabled and cannot be clicked.",WI-502-004: Implement Settings Menu,"All acceptance criteria met. Delete button, confirmation dialog, and success notification are implemented. File system operation is robust and correctly scoped. Button state is managed correctly."
US-059,Presentation & User Interface (UI),"Start an optional interactive tutorial to learn the game","As a new player, I want to start an optional, interactive tutorial so that I can learn the basic rules and game controls in a guided, hands-on environment.",Should Have,8,"US-008, US-015, US-016, US-030, US-044, US-023","Given the user is on the main menu, when the user clicks the 'Tutorial' button, then the game transitions to a dedicated, scripted tutorial game state.","Given the tutorial has started, when the tutorial prompts the player to roll the dice by highlighting the 'Roll' button, then all other UI elements are non-interactive, and the dice animate a pre-determined roll result after being clicked.","Given the player has completed the final guided action in the tutorial script, when the final action is confirmed, then a 'Tutorial Complete' modal dialog is displayed with options to 'Start New Game' and 'Return to Main Menu'.","WI-802-001: Implement Digital Rulebook","All acceptance criteria met. Tutorial is accessible from main menu and guides the user through key mechanics. Scripted events and UI highlighting are functional. Early exit and completion flows work correctly."
