story_id,epic,title,user_role,description,priority,story_points,dependencies,"acceptance_criteria_1","acceptance_criteria_2","acceptance_criteria_3",technical_tasks,definition_of_done
US-001,Build, Packaging & Distribution,"Install the game on my Windows PC",As a Windows PC gamer, I want to run a simple, guided installer for Monopoly Tycoon, so that I can get the game set up on my computer quickly and without errors, and start playing right away.,Must Have,5,"","Given I have downloaded the standalone installer executable for Monopoly Tycoon on a Windows PC with sufficient disk space and administrative rights, when I run the installer and accept all default options by clicking 'Next' through the wizard, accept the EULA, and click 'Install', then The installer copies all game files to the default program files directory, a progress bar is shown, and a completion screen appears.","Given I have started the installer on a machine where the target drive has less than the required 2 GB of free space, when I click the 'Install' button on the final confirmation step, then the installer must display a user-friendly error message stating that there is insufficient disk space and specifying the required amount.","Given I am logged into a standard Windows user account without administrative privileges, when I run the installer executable, then the Windows User Account Control (UAC) prompt must appear, requesting elevation to administrative privileges.",WI-801-001: Develop Inno Setup Installer Script,"All acceptance criteria met. Installer is a single, digitally signed executable. Manual E2E testing on Windows 10 & 11 is complete. Uninstaller is correctly registered."
US-002,Build, Packaging & Distribution,"Choose a custom installation directory",As a Windows PC user installing the game, I want to be able to choose a custom installation directory so that I can manage my disk space and organize my installed applications according to my personal preferences.,Should Have,1,US-001,"Given the user is running the game installer and has reached the 'Choose Install Location' screen, when the user clicks the 'Browse...' button, selects a valid directory on a different drive (e.g., 'D:\\Games'), and proceeds with the installation, then the installer successfully installs all game files into the 'D:\\Games\\MonopolyTycoon' directory.","Given the user is on the 'Choose Install Location' screen, when the user views the screen or selects a different drive, then the UI accurately displays the total disk space required for the game and the available disk space on the currently selected drive, updating dynamically when the drive is changed.","Given the user is on the 'Choose Install Location' screen, when the user selects a directory on a drive where the available space is less than the required space, then the installer displays a clear error message stating 'Insufficient disk space' and the 'Install' button is disabled.",WI-801-001: Develop Inno Setup Installer Script,"All acceptance criteria met. Installer script is updated and peer-reviewed. Manual testing confirms custom path installation and disk space validation work correctly."
US-003,Build, Packaging & Distribution,"Provide an option to create a desktop shortcut during installation",As a new player installing the game, I want to see a checkbox option to create a desktop shortcut during the installation process, so that I can easily find and launch the game directly from my desktop after it's installed.,Should Have,1,US-001,"Given the user is running the game installer, when the user navigates to the 'Select Additional Tasks' screen and sees the 'Create a desktop shortcut' option is checked by default, and they proceed with the installation, then a shortcut named 'Monopoly Tycoon' is created on the user's desktop.","Given a desktop shortcut was created via the installer, when the user inspects the shortcut's properties, then the shortcut displays the official game icon and its target path correctly points to the game's primary executable in the chosen installation directory.","Given a desktop shortcut was created via the installer, when the user double-clicks the desktop shortcut, then the Monopoly Tycoon game application launches successfully.",WI-801-001: Develop Inno Setup Installer Script,"All acceptance criteria met. Installer script is updated and peer-reviewed. Manual testing confirms shortcut is created, functional, and optional."
US-004,Presentation & User Interface (UI),"Ensure UI and Game View Adapt to Different Monitor Aspect Ratios","As a PC gamer with a monitor of any common aspect ratio, I want the game's user interface and 3D view to automatically adapt to my screen's dimensions so that I can play the game without any visual distortion, overlapping elements, or loss of critical information.",Must Have,5,"US-023, US-024, US-025","Given the game is launched in fullscreen mode on a display with a 16:9 aspect ratio (e.g., 1920x1080), when the user navigates to the main gameplay screen, then the game board is fully visible and centered, and all HUD elements are positioned correctly in their designated corners without overlapping.","Given the game is launched in fullscreen mode on a display with a 21:9 aspect ratio (e.g., 2560x1080), when the user views the main gameplay screen, then the game board maintains its correct proportions, HUD elements are anchored correctly, and modal dialogs appear centered and are not horizontally stretched.","Given the game is running in windowed mode, when the user clicks and drags the window border to change its size and aspect ratio, then the UI layout and game view dynamically update to fit the new dimensions upon releasing the mouse button without errors.",WI-501-001: Implement 3D Game Board and Camera,"All acceptance criteria met for 16:9, 16:10, and 21:9 aspect ratios. Manual E2E testing confirms no visual regressions on supported resolutions. UI layout is reviewed and approved."
US-005,Project Foundation & Core Systems,"Receive guidance on locating log files after an error","As a player who has encountered an unexpected game crash, I want to be shown a clear error message that includes a unique error ID and instructions on where to find the log files, so that I can easily provide developers with the necessary information to diagnose and fix the bug.",Must Have,5,US-002,"Given the game is running and an unhandled exception occurs in the application's code, when the global exception handler catches the exception, then a modal error dialog is displayed, blocking interaction with the game window.","Given the error dialog is displayed, when the user views the dialog content, then the dialog contains a non-technical message, a unique Error ID, and the full, absolute path to the user's log directory.","Given an unhandled exception has been caught and an Error ID is displayed to the user, when the exception is processed by the logging system, then a log entry at the 'ERROR' level is written to the log file, containing the full exception details and the exact same Error ID shown in the dialog.","WI-102-001: Implement Global Unhandled Exception Handler; WI-102-002: Create Modal Error Dialog UI","All acceptance criteria met. Global exception handler is registered and functional. Error dialog UI is implemented and approved. Manual testing confirms the end-to-end flow from crash to log file verification."
US-006,Build, Packaging & Distribution,"Uninstall the game cleanly from my computer",As a Windows PC user who no longer wishes to keep the game installed, I want a standard and thorough uninstallation process so that I can completely remove all application files and reclaim my disk space, ensuring my system remains clean.,Must Have,2,"US-001, US-007","Given the game is successfully installed on a Windows machine, when the user navigates to 'Apps & features', selects 'Monopoly Tycoon', and clicks 'Uninstall', then the uninstallation wizard is launched, and the game's entry is removed from the list upon completion.","Given the user has initiated the uninstallation process and confirmed they wish to proceed, when the uninstaller completes successfully, then the main installation directory and all its contents are deleted, the desktop shortcut is removed, and the Start Menu folder/shortcut is removed.","Given the Monopoly Tycoon game application is currently running, when the user attempts to launch the uninstaller, then the uninstaller displays a clear error message stating the game must be closed before proceeding and will not continue until the application is terminated.",WI-801-002: Implement Uninstaller Logic,"All acceptance criteria met. Uninstaller script is peer-reviewed. Manual testing confirms complete removal of application files and correct handling of running processes."
US-007,Build, Packaging & Distribution,"Choose to keep my personal data upon uninstallation","As a Windows PC Gamer who needs to uninstall the game, I want to be given a clear choice to keep or delete my personal game data (like save files and player profile) so that I can reinstall the game later without losing all my progress and achievements.",Should Have,2,"US-006, US-026, US-030","Given the game is installed and the user has created personal data located in the '%APPDATA%/MonopolyTycoon' directory, when the user runs the uninstaller and selects 'No' at the prompt asking to remove personal data, then the application files and shortcuts are completely removed, but the '%APPDATA%/MonopolyTycoon' directory and all its contents remain untouched.","Given the game is installed and the user has created personal data located in the '%APPDATA%/MonopolyTycoon' directory, when the user runs the uninstaller and selects 'Yes' at the prompt asking to remove personal data, then the application files and shortcuts are completely removed, AND the '%APPDATA%/MonopolyTycoon' directory and all its contents are also deleted.","Given the user is uninstalling the game and personal data exists, when the uninstaller displays the prompt for data removal, then the dialog text explicitly mentions 'save games, player profiles, and statistics', and the default selected button is 'No' (to keep data).",WI-801-002: Implement Uninstaller Logic,"All acceptance criteria met. Uninstaller script logic is peer-reviewed. Manual E2E testing of all scenarios (keep, delete, no data) is completed and passed."
US-008,Presentation & User Interface (UI),"Start a new game from the main menu","As a player, I want to select a 'New Game' option from the main menu so that I can proceed to the game setup screen and configure a new match.",Must Have,1,"","Given the player is on the main menu screen, when the player clicks the 'New Game' button, then the application transitions to the Game Setup screen, and the main menu screen is no longer visible or interactive.","Given the player is on the main menu screen, when the player uses keyboard navigation to focus on the 'New Game' button and presses the activation key, then the application transitions to the Game Setup screen.","Given the player is on the main menu screen, when the player clicks the 'New Game' button multiple times in quick succession, then the application transitions to the Game Setup screen only once, without errors or unexpected behavior.",WI-502-001: Create Game Setup Screen,"All acceptance criteria met. Main menu button correctly transitions to the game setup scene. Transition is performant and handles repeated inputs gracefully."
US-009,Presentation & User Interface (UI),"Configure a game with one to three AI opponents","As a player setting up a new game, I want to select the number of AI opponents from a choice of one, two, or three, so that I can customize the game's challenge, duration, and overall experience to my preference.",Must Have,1,US-008,"Given I am on the game setup screen, when I select '3' as the number of AI opponents and start the game, then a new game session is created with a total of four players: one human and three AIs.","Given I navigate to the game setup screen for the first time, when the screen finishes loading, then a default value (e.g., '2' AI opponents) is pre-selected in the UI.","Given I am on the game setup screen, when I change the selected number of AI opponents from '1' to '3', then the UI dynamically updates to display configuration sections for three distinct AI opponents.",WI-502-001: Create Game Setup Screen,"All acceptance criteria met. UI control is implemented and approved. Integration testing confirms selection correctly influences player count at game start."
US-010,Presentation & User Interface (UI),"Set a unique difficulty level for each AI opponent","As a Human Player setting up a new game, I want to independently assign a difficulty level (Easy, Medium, or Hard) to each of my AI opponents so that I can customize the game's challenge to match my skill level and desired experience.",Must Have,3,"US-009, US-019","Given I am on the Game Setup screen and have selected 3 AI opponents, when I set the difficulty for 'AI 1' to 'Easy', 'AI 2' to 'Hard', and 'AI 3' to 'Medium', then the UI must clearly display 'Easy' for AI 1, 'Hard' for AI 2, and 'Medium' for AI 3 respectively.","Given I am on the Game Setup screen, when I increase the number of AI opponents from 1 to 2, then a new UI section for 'AI 2' appears, and its difficulty selector defaults to 'Medium'.","Given I have configured a game with two AI opponents set to 'Easy' and 'Hard', when I start the game, then the internal PlayerState objects for the two AIs must be initialized with 'ai_difficulty' properties of 'Easy' and 'Hard' respectively.",WI-502-001: Create Game Setup Screen,"All acceptance criteria met. UI controls for each AI slot are implemented. Integration testing confirms difficulties are correctly passed to the GameState on start."
US-011,Player & AI System,"Create a player profile with a custom name","As a new or returning player, I want to create a personal profile by entering a custom name, so that my game progress, historical statistics, and high scores are saved and displayed under my unique identity.",Must Have,2,US-008,"Given the player is on the game setup screen, when the player enters a valid name (e.g., 'BoardwalkKing') and proceeds with game setup, then a new player profile is created and persisted with the entered name and a unique internal profile_id.","Given the player is on the game setup screen, when the player enters a name with fewer than 3 characters (e.g., 'Ty') and attempts to proceed, then a user-friendly validation message is displayed indicating the name is too short, and the game setup does not proceed.","Given a player has successfully created a profile with the name 'CashMoney', when the game starts, then the human player's name is displayed as 'CashMoney' in the main game HUD.",WI-502-001: Create Game Setup Screen,"All acceptance criteria met. Input validation logic is implemented and unit tested. Integration with database persistence is successful. Name is correctly displayed in-game."
US-012,Presentation & User Interface (UI),"Receive feedback for an invalid profile name","As a player setting up my profile, I want to receive immediate and clear feedback if the name I enter is invalid, so that I can easily correct it and proceed to start the game without frustration.",Must Have,1,US-011,"Given the player is on the game setup screen, when the player enters a name with fewer than 3 characters, then a specific error message 'Name must be at least 3 characters long' is displayed below the input field, and the option to proceed is disabled.","Given the player is on the game setup screen, when the player enters a name containing special characters (e.g., 'Player!@#'), then a specific error message 'Name can only contain letters and numbers' is displayed, and the option to proceed is disabled.","Given the player has entered an invalid name and an error message is currently displayed, when the player edits the name so that it meets all validation criteria, then the error message disappears, and the option to proceed becomes enabled.",WI-502-001: Create Game Setup Screen,"All acceptance criteria met. Real-time validation UI is implemented and approved. Unit tests for validation logic cover all rules and edge cases."
US-013,Data Persistence & Management,"View my persistent historical gameplay statistics","As a returning player, I want to access a dedicated screen that displays my cumulative gameplay statistics from all my completed games, so that I can track my performance, see my win/loss record, and feel a sense of long-term progression and achievement.",Should Have,5,"US-011, US-016, US-046, US-047","Given the player has completed at least one game, when the player selects the 'Player Statistics' option from the main menu, then a dedicated statistics screen is displayed showing correct values for all required metrics like Total Wins, Win/Loss Ratio, etc.","Given the player has created a profile but has not completed any games, when the player navigates to the 'Player Statistics' screen, then the screen displays all statistical categories with appropriate default values (e.g., 'Total Games Played: 0').","Given the player has existing statistics, when the player completes and wins a new game and returns to the main menu, then the 'Total Games Played' and 'Total Wins' statistics are correctly incremented, and the 'Win/Loss Ratio' is recalculated.",WI-602-002: Implement Statistics Repository,"All acceptance criteria met. Statistics screen UI is implemented. End-to-end flow from game completion to database update is tested and verified."
US-014,Presentation & User Interface (UI),"Select my player token from a set of classic options","As a player setting up a new game, I want to choose my game piece from a visual selection of classic tokens, so that I can personalize my in-game identity and feel more connected to the game experience.",Must Have,2,"US-008, US-009, US-011","Given the player is on the game setup screen, when the player clicks on an available token (e.g., 'Top Hat'), then the 'Top Hat' token becomes visually highlighted, and a preview is shown next to the player's name.","Given the player has selected a token and configured a game with 3 AI opponents, when the player starts the game, then the AI opponents are each assigned a unique token from the pool of tokens not selected by the human player.","Given the player selected the 'Battleship' token during game setup, when the main game view loads, then the player's 3D game piece on the board and their icon in the HUD is the 'Battleship'.",WI-502-001: Create Game Setup Screen,"All acceptance criteria met. Token selection UI is implemented and approved. AI token assignment is verified to ensure uniqueness. Selected token is correctly displayed in-game."
US-015,Core Gameplay Engine & Rule Implementation,"Roll two six-sided dice to start my move",As a human player whose turn it is, I want to click a button to roll two virtual dice, so that I can determine the number of spaces my token will move and proceed with my turn.,Must Have,3,"US-008, US-029","Given it is the human player's turn and they are in the 'Pre-Roll Management Phase', when the player clicks the 'Roll Dice' button, then the system generates two random integer values, each between 1 and 6 inclusive, using a cryptographically secure method.","Given it is an AI player's turn OR the human player is not in the 'Pre-Roll Management Phase', when the game state is updated, then the 'Roll Dice' button is visually disabled and non-interactive.","Given the player has set the 'Game Speed' setting to 'Instant', when the player clicks the 'Roll Dice' button, then the dice roll animation is skipped entirely, but the result is still calculated and displayed correctly before the token moves.",WI-202-002: Implement Dice Rolling Logic,"All acceptance criteria met. Dice roll is integrated into the turn state machine. 'Roll Dice' button state is managed correctly. Dice roll animation is polished and respects game speed settings."
US-016,Presentation & User Interface (UI),"Watch my token automatically move around the board","As a player, I want to see my game token animate its movement from one space to the next after I roll the dice, so that I can visually track my progress around the board and have an immersive, intuitive gameplay experience.",Must Have,5,"US-014, US-015, US-025","Given the player's token is on 'St. Charles Place' (index 11), when the player completes a dice roll with a total of 5, then the token animates moving sequentially across 5 spaces, landing on 'Indiana Avenue' (index 16), and the camera smoothly follows the token's movement.","Given the player has set the 'Game Speed' to 'Instant' in the settings menu, when the player's token needs to move, then the token instantly teleports to the destination space without a sequential movement animation, accompanied by a brief visual effect.","Given a player's turn results in them being sent to Jail, when the game logic directs the player to Jail, then the token does not animate space-by-space but instead plays a special, direct animation from its current space to the 'In Jail' section of the board.",WI-501-002: Implement Token Movement and Dice Animations,"All acceptance criteria met. Token movement is smooth and visually appealing. Camera follow is implemented. Special move cases (Jail) and game speed settings are handled correctly."
US-017,Core Gameplay Engine & Rule Implementation,"Receive an extra turn after rolling doubles","As a player (human or AI), I want to be granted an immediate, additional turn after I roll doubles, so that the game correctly follows the official Monopoly rules and provides an authentic gameplay experience.",Must Have,2,"US-015, US-016, US-022","Given it is a player's turn and their consecutive doubles count is 0, when the player rolls doubles, then the player's token moves, the destination space action is completed, the game state confirms it is still the same player's turn, and their consecutive doubles count is incremented to 1.","Given a player has just completed a turn by rolling doubles, when the player rolls again and the result is not a double, then the player moves, their consecutive doubles count is reset to 0, and the turn passes to the next player.","Given a player is in the 'InJail' state, when the player rolls doubles to get out, then the player moves, completes their action, and their turn ends; they are NOT granted an extra turn.",WI-202-002: Implement Dice Rolling Logic,"All acceptance criteria met. Doubles logic is integrated with the turn manager. Consecutive doubles are tracked. The 'get out of jail' exception is correctly implemented and tested."
US-018,Core Gameplay Engine & Rule Implementation,"Be sent to jail for rolling three consecutive doubles","As a player, I want the game to automatically send my token to jail if I roll three consecutive doubles in a single turn, so that the game correctly enforces the official rules.",Must Have,2,"US-015, US-017, US-020","Given a player is taking their turn and has already rolled doubles twice in a row, when the player rolls the dice for a third time and the result is doubles, then the player's token is immediately moved directly to the 'In Jail' space, their turn ends, and play passes to the next player.","Given a player has rolled doubles twice and is on a space near GO (e.g., Boardwalk), when the player rolls their third consecutive double, then the player's token is sent directly to Jail and does not collect the $200 GO salary.","Given an AI player is taking its turn and has already rolled doubles twice in a row, when the AI player's third roll is doubles, then the AI player is sent to jail, its turn ends, and a non-intrusive notification is displayed to the human player about the event.",WI-202-002: Implement Dice Rolling Logic,"All acceptance criteria met. Logic for tracking and acting on the third double is implemented and tested. Go to Jail action correctly bypasses normal movement and GO salary."
US-019,Core Gameplay Engine & Rule Implementation,"Collect $200 salary when passing or landing on GO","As a Player, I want my cash balance to be automatically credited with a $200 salary for completing a lap of the board, so that the game correctly follows the official rules.",Must Have,1,"US-016, US-023","Given a player's token is on 'Boardwalk' (space 39) with a cash balance of $500, when the player rolls a 5, causing their token to move past GO and land on 'Baltic Avenue' (space 3), then the player's cash balance is automatically increased to $700.","Given a player's token is on 'Park Place' (space 37) with a cash balance of $500, when the player rolls a 3, causing their token to land exactly on 'GO' (space 0), then the player's cash balance is automatically increased to $700.","Given a player's token is on a Chance space and they draw a card that reads 'Go to Jail', when the card action is executed, then the player's token is moved directly to the 'In Jail' location and their cash balance remains unchanged.",WI-202-003: Implement Core Board Space Actions,"All acceptance criteria met. Salary collection logic is implemented and correctly handles both passing and landing on GO. Exceptions for 'Go to Jail' are correctly handled."
