story_id,epic,title,user_role,description,priority,story_points,dependencies,"acceptance_criteria_1","acceptance_criteria_2","acceptance_criteria_3",technical_tasks,definition_of_done
US-020,Core Gameplay Engine & Rule Implementation,"Get out of jail by paying the $50 fine","As a player who is in jail, I want to be presented with the option to pay a $50 fine at the beginning of my turn, so that I can immediately get out of jail and continue my turn normally.",Must Have,1,US-018,"Given I am in the 'InJail' state and it is the start of my turn with a cash balance of $1500, when the game presents the 'Get Out of Jail' options and I select the 'Pay $50 Fine' option, then my cash balance is reduced to $1450, my player status is updated to 'Active', and I proceed to the Pre-Roll Management phase of my turn.","Given I am in the 'InJail' state with a cash balance of $49, when the game presents the 'Get Out of Jail' options, then the 'Pay $50 Fine' option is visually disabled and non-interactive.","Given I am in the 'InJail' state with a cash balance of exactly $50, when I select the 'Pay $50 Fine' option, then my cash balance is reduced to $0, my player status is updated to 'Active', and I proceed with my turn.",WI-202-003: Implement Core Board Space Actions,"All acceptance criteria met. Jail options UI is implemented. Payment logic is integrated with player state and turn manager. Insufficient funds case is handled correctly."
US-021,Core Gameplay Engine & Rule Implementation,"Get out of jail by using a 'Get Out of Jail Free' card","As a player who is in jail and owns a 'Get Out of Jail Free' card, I want to be presented with the option to use it at the start of my turn, so that I can get out of jail immediately without spending money.",Must Have,2,"US-018, US-020, US-024, US-025","Given the player's status is 'InJail' and their 'get_out_of_jail_cards' count is 1, when the player selects 'Use Get Out of Jail Free Card', then the player's 'status' is updated to 'Active', their 'get_out_of_jail_cards' count becomes 0, and they proceed to a normal turn.","Given the player uses a 'Get Out of Jail Free' card that originated from the Chance deck, when the action to use the card is confirmed, then the specific card is placed at the bottom of the Chance card deck.","Given the player's status is 'InJail' and their 'get_out_of_jail_cards' count is 0, when their turn begins and the jail options are presented, then the UI option to 'Use Get Out of Jail Free Card' is not displayed or is disabled.",WI-202-003: Implement Core Board Space Actions,"All acceptance criteria met. Logic for using the card is implemented and tested. Card is correctly removed from player inventory and returned to the correct deck. UI option is conditional."
US-022,Core Gameplay Engine & Rule Implementation,"Attempt to get out of jail by rolling for doubles","As a player in jail, I want to choose the option to roll the dice on my turn, so that I can attempt to get out of jail for free by rolling doubles.",Must Have,3,"US-015, US-016, US-018, US-023","Given I am in the Jail space with a status of 'InJail', when I select the 'Roll for Doubles' option and my roll is doubles, then my player status is updated to 'Active', my token moves the number of spaces shown on the dice, and my turn ends (no extra turn).","Given I am in the Jail space with a status of 'InJail', when I select the 'Roll for Doubles' option and my roll is not doubles, then my 'jail_turns_remaining' is decremented by 1 and my turn immediately ends.","Given the jail action menu is displayed with multiple options ('Roll for Doubles', 'Pay Fine'), when I click the 'Roll for Doubles' button, then all other options in the jail action menu become disabled and the dice roll sequence is initiated.",WI-202-003: Implement Core Board Space Actions,"All acceptance criteria met. All success, failure, and UI state change scenarios are implemented and tested. Special rule for no extra turn is explicitly verified."
US-023,Core Gameplay Engine & Rule Implementation,"Be forced to pay the fine after failing to roll doubles for 3 turns in jail","As a player in jail for my third consecutive turn, I want the game to automatically force me to pay the $50 fine if I fail to roll doubles, so that the official game rules are enforced and my turn can proceed correctly.",Must Have,5,"US-022, US-038, US-047","Given a player is in the 'InJail' state, their 'jail_turns_remaining' count is 1 (indicating the 3rd turn), and they have more than $50 cash, when the player chooses to roll the dice and the result is not doubles, then the player's cash is reduced by $50, their status changes to 'Active', and their token moves the number of spaces shown on the dice.","Given a player is in the 'InJail' state and their 'jail_turns_remaining' count is 1, when the player chooses to roll the dice and the result is doubles, then the player's cash is not changed, their status changes to 'Active', and their token moves, but they do not get an extra turn.","Given a player is in the 'InJail' state, their 'jail_turns_remaining' count is 1, and they have less than $50 cash, when the player rolls the dice and the result is not doubles, then the game flow is paused, and the player is prompted to raise funds to cover the $50 debt before their turn can proceed.",WI-202-003: Implement Core Board Space Actions,"All acceptance criteria met. All scenarios (sufficient funds, insufficient funds, doubles roll) are implemented and tested. Integration with bankruptcy system is verified."
US-024,Core Gameplay Engine & Rule Implementation,"Draw a Chance card when landing on a Chance space","As a player, I want the game to automatically draw a Chance card and execute its instructions when my token lands on a Chance space, so that the game follows the official rules and introduces an element of luck.",Must Have,5,"US-016, US-018, US-019, US-047","Given a player lands on a Chance space and the top card is 'Bank pays you dividend of $50', when the card is drawn, then a UI element displays the card, the player's cash balance is increased by $50, and the card is placed at the bottom of the Chance deck.","Given a player lands on a Chance space and draws the 'Get Out of Jail Free' card, when the card is drawn, then the card is displayed, the player's 'get_out_of_jail_cards' count becomes 1, and this specific card is removed from the deck cycle until used.","Given a player lands on a Chance space and draws the 'Go to Jail' card, when the card is drawn, then the card is displayed, the player's token moves directly to the 'In Jail' space, their status is set to 'InJail', and they do not collect $200 for passing Go.",WI-201-003: Implement Card Deck Management Logic,"All acceptance criteria met. All 16 standard Chance cards are implemented and tested. Card drawing, execution, and deck cycling logic is verified. Integration with Jail, Go, and Bankruptcy systems is complete."
US-025,Core Gameplay Engine & Rule Implementation,"Draw a Community Chest card when landing on a Community Chest space","As a player, I want the game to automatically draw a Community Chest card and execute its instructions when my token lands on a Community Chest space, so that the game correctly follows the official rules.",Must Have,5,"US-016, US-018, US-047","Given a player lands on Community Chest, when they draw a card instructing them to collect money (e.g., 'Bank error in your favor. Collect $200'), then the player's cash balance and the HUD is increased by the specified amount.","Given a player lands on Community Chest, when they draw the 'Go to Jail' card, then the player's token is moved directly to the 'In Jail' section of the board and their turn ends immediately.","Given a player lands on Community Chest and there are other active players, when they draw a card like 'It is your birthday. Collect $10 from every player', then the active player's cash balance increases by $10 for each opponent, and each opponent's cash balance decreases by $10.",WI-201-003: Implement Card Deck Management Logic,"All acceptance criteria met. All 16 standard Community Chest cards are implemented and tested. Card logic, including multi-player transactions, is verified. Integration with other systems is complete."
US-026,Core Gameplay Engine & Rule Implementation,"Choose to pay $200 or 10% of my net worth for Income Tax","As a human player, I want to be presented with a clear choice between paying a flat $200 or 10% of my total net worth when I land on the Income Tax space, so that I can make the most strategic financial decision.",Must Have,5,"US-016, US-038, US-033, US-047","Given the human player's token's movement ends on the 'Income Tax' space, when the movement phase concludes, then the game flow pauses and a modal dialog is displayed to the player with two choices.","Given the player has $500 cash and properties/buildings worth $1500 (Total Net Worth = $2000), when the Income Tax dialog is displayed, then the dialog must present two choices: one for a flat '$200' and another for '10% of Net Worth' which displays the calculated value of '$200'.","Given the player has $100 cash and a total net worth of $1500, when the player selects either the '$200' or '$150' option, then the game initiates the asset liquidation flow, requiring the player to mortgage properties or sell buildings to cover the chosen debt.",WI-202-003: Implement Core Board Space Actions,"All acceptance criteria met. Net worth calculation is accurate and unit tested. UI dialog is implemented and approved. Integration with bankruptcy/liquidation flow is verified."
US-027,Core Gameplay Engine & Rule Implementation,"Pay a fixed Luxury Tax amount",As a player, I want the game to automatically deduct the fixed Luxury Tax amount from my cash when I land on that space, so that the game correctly follows the official rules.,Must Have,2,"US-016, US-038, US-047, US-052","Given a player has a cash balance greater than the Luxury Tax amount, when the player's token movement ends on the 'Luxury Tax' space, then the fixed tax amount is deducted from the player's cash balance and a notification is displayed.","Given a player has a cash balance less than the Luxury Tax amount but owns assets, when the player's token movement ends on the 'Luxury Tax' space, then the game flow is paused, and the player is prompted to manage their assets to pay the debt.","Given a player has a cash balance less than the Luxury Tax amount and cannot raise sufficient funds, when their token movement ends on the 'Luxury Tax' space, then the player is declared bankrupt to the Bank.",WI-202-003: Implement Core Board Space Actions,"All acceptance criteria met. Tax deduction logic is implemented. Integration with asset liquidation and bankruptcy systems is complete and tested."
US-028,Core Gameplay Engine & Rule Implementation,"Experience no gameplay effect when landing on Free Parking","As a player, I want the game to apply no special action when my token lands on the Free Parking space so that the game adheres to the official Monopoly rules.",Must Have,1,"US-015, US-016, US-017, US-019","Given a player is in an active turn and has not rolled doubles, when the player's token movement concludes on the 'Free Parking' space, then the player's cash balance remains unchanged, no action prompt is displayed, and the game proceeds to the next player's turn.","Given a player is in an active turn and rolls doubles, when the player's token movement concludes on the 'Free Parking' space, then the player's cash balance remains unchanged and the game prompts the player to take their extra turn.","Given a player is on a space before GO with $500 cash, when the player rolls a number that causes them to pass GO and land on 'Free Parking', then the player's cash balance first increases by $200 for passing GO, resulting in a final balance of $700.",WI-202-003: Implement Core Board Space Actions,"All acceptance criteria met. Logic for Free Parking is implemented as a no-op. Interaction with doubles rule and Pass Go rule is verified."
US-029,Core Gameplay Engine & Rule Implementation,"Manage my properties before rolling the dice","As a strategic player, I want a dedicated phase at the start of my turn to manage my properties (build, mortgage, trade) before I roll the dice, so that I can proactively adjust my financial position.",Must Have,5,"US-015, US-033, US-038, US-040, US-052","Given it is the start of the human player's turn and the player is not in jail, when the game transitions control to the human player, then the game enters a 'Pre-Roll Management Phase', the 'Roll Dice' button is enabled, and property management UI controls are enabled.","Given the player is in the 'Pre-Roll Management Phase', when the player successfully builds a house and then clicks the 'Roll Dice' button, then the house is added, cash is deducted, property management controls become disabled, and the game proceeds to the 'Roll Phase'.","Given the player has just completed a turn where they rolled doubles, when the game grants the player an extra turn, then the game returns to the 'Pre-Roll Management Phase', allowing the player to manage properties again before their next roll.",WI-202-001: Develop Turn Management State Machine,"All acceptance criteria met. The turn state machine correctly implements the Pre-Roll phase, waiting for player input. Integration with management actions (build, trade, etc.) is verified."
US-030,Property & Economic System,"Choose to buy an unowned property I land on","As a human player, I want to be presented with a clear prompt when I land on an unowned property, giving me the option to purchase it, so that I can strategically acquire assets.",Must Have,5,"US-016, US-050","Given I am the human player with $1000 in cash, when my token's movement ends on the unowned property 'St. Charles Place' (list price $140), then a modal dialog is displayed with options to 'Buy' or 'Auction'.","Given the property purchase dialog is displayed and I click the 'Buy' button, then my cash is reduced by $140, 'St. Charles Place' is added to my list of owned properties, and the board is visually updated to show my ownership.","Given I am the human player with $100 in cash, when my token lands on the unowned 'St. Charles Place' (list price $140), then the property purchase dialog is displayed, but the 'Buy' button is disabled.",WI-301-001: Implement Property Purchase and Auction Logic,"All acceptance criteria met. Purchase dialog UI is implemented and approved. Purchase transaction is atomic and correctly updates game state and visuals. Insufficient funds case is handled."
US-031,Property & Economic System,"Choose to send an unowned property to auction instead of buying it","As a Human Player, I want the option to decline the immediate purchase of an unowned property I land on so that I can trigger an auction for that property.",Must Have,2,"US-030, US-032, US-016","Given I am the human player and have landed on an unowned property, when the game presents me with a modal dialog to buy the property, then the dialog must display two distinct, enabled options: 'Buy' and 'Auction'.","Given the purchase decision dialog is displayed, when I click the 'Auction' button, then the purchase decision dialog closes immediately and the auction process begins, involving all active players.","Given I have landed on an unowned property that I do not have sufficient cash to purchase, when the game presents me with the purchase decision dialog, then the 'Buy' button must be visually disabled, and the 'Auction' button must remain enabled.",WI-301-001: Implement Property Purchase and Auction Logic,"All acceptance criteria met. The 'Auction' button is present on the purchase dialog and correctly triggers the auction system. Button states for insufficient funds are correct."
US-032,Property & Economic System,"Participate in an auction for a property","As a Human Player, I want to participate in a turn-based auction for an unowned property, placing bids against AI opponents, so that I have a strategic opportunity to acquire properties.",Must Have,5,US-031,"Given an auction is in progress for 'Boardwalk', when the human player places a valid winning bid and all other players withdraw, then the auction UI closes, the final bid amount is deducted from the human player's cash, and 'Boardwalk' is added to their portfolio.","Given an auction is in progress and it is the human player's turn to bid, when the human player selects the 'Withdraw' or 'Pass' option, then the human player is marked as inactive for this auction, and the turn passes to the next player in the bidding order.","Given an auction is in progress, the current high bid is $200, and the human player has $205 cash, when it is the human player's turn and the minimum next bid is $206, then the 'Place Bid' button is disabled, leaving 'Withdraw' as the only available action.",WI-301-001: Implement Property Purchase and Auction Logic,"All acceptance criteria met. Auction UI is implemented and approved. Bidding, winning, and withdrawing logic is fully functional. Insufficient funds case is handled correctly."
US-033,Property & Economic System,"Build houses on properties in a complete color set","As a player who owns a complete color set, I want to purchase and build houses on those properties so that I can increase the rent value.",Must Have,5,"US-030, US-052, US-034, US-036","Given I own all Light Blue properties, they are unmortgaged, I have over $50 cash, and the bank has houses, when I choose to build one house on Oriental Avenue, then my cash is reduced by $50, the bank's house count decreases by one, and a house appears on the Oriental Avenue space.","Given I own Oriental Avenue and Vermont Avenue, but not Connecticut Avenue, when I access the property management screen, then the option to build houses on my Light Blue properties is disabled.","Given I own the complete Light Blue monopoly but Oriental Avenue is mortgaged, when I attempt to build a house on Connecticut Avenue, then the action is blocked.",WI-302-001: Implement Building Rules and Logic,"All acceptance criteria met. Building logic correctly validates monopoly ownership and mortgage status. Game state and visuals are updated correctly on successful build."
US-034,Property & Economic System,"Enforce even building rule for property development","As a player who owns a complete property set, I want the game to enforce the 'even building' rule when I try to purchase or sell houses, so that the game is fair and follows official Monopoly rules.",Must Have,5,"US-033, US-052, US-038","Given I own a three-property monopoly where Property A has 1 house, and Properties B and C have 0 houses, when I attempt to build a second house on Property A, then the action is blocked, and the UI provides feedback explaining that I must build evenly.","Given I own a monopoly where every property has exactly one house, when I attempt to build a second house on any single property in that set, then the transaction is successful, and the selected property now has two houses.","Given I own a monopoly where Property A has 3 houses, and Properties B and C each have 2 houses, when I attempt to sell a house from Property B or C, then the action is blocked, and the UI indicates that I must sell from the property with the most houses first (Property A).",WI-302-001: Implement Building Rules and Logic,"All acceptance criteria met. 'Even building' and 'even selling' logic is implemented and unit tested. UI provides clear feedback and correctly disables/enables actions based on the rule."
US-035,Property & Economic System,"Upgrade a set of 4 houses to a single hotel","As a strategic player who has developed a monopoly with four houses on each property, I want to purchase a hotel for each of those properties, so that I can charge the maximum possible rent.",Must Have,5,"US-033, US-034, US-052","Given I own a monopoly where every property has exactly 4 houses, I have sufficient cash, and the Bank has hotels, when I initiate the 'Build Hotel' action, then my cash is reduced by the hotel cost, the Bank's hotel count decreases by 1, house count increases by 4, and the board visual changes from 4 houses to 1 hotel.","Given I own a monopoly where two properties have 4 houses, but a third property has only 3 houses, when I select any property within that monopoly, then the option to build a hotel is disabled.","Given I am eligible to build a hotel but the Bank's supply of 12 hotels is exhausted, when I attempt to purchase a hotel, then the transaction is blocked, and a UI notification informs me of the hotel shortage.",WI-302-001: Implement Building Rules and Logic,"All acceptance criteria met. Hotel upgrade logic is implemented and tested. All prerequisites (even building, bank supply, cash) are correctly validated. Game state and visuals are updated atomically."
US-036,Property & Economic System,"Notify player of building shortage when attempting to build",As a player, I want to receive a clear notification when I am unable to build because the bank has run out of houses or hotels, so that I understand the game state.,Should Have,2,"US-033, US-052","Given I am on the Property Management screen, when I attempt to purchase a house and the bank's supply of houses is 0, then the purchase action is prevented, and a non-modal notification appears with text like 'Cannot build: No houses available in the bank.'","Given the bank's supply of houses is 0, when I view my properties in the Property Management interface, then the 'Build House' button(s) for all eligible properties are visually disabled.","Given the bank's supply of houses was 0 and the build buttons were disabled, when another player sells houses back to the bank, then on my next turn, the 'Build House' buttons in my interface become enabled again.",WI-302-002: Implement Building Shortage and Auction,"All acceptance criteria met. UI provides clear, non-modal feedback for building shortages. Build buttons are dynamically disabled/enabled based on bank supply."
US-037,Property & Economic System,"Participate in an auction for the last available buildings","As a strategic player, I want to participate in an auction for the last available houses or hotels when there's a building shortage, so that I have a fair chance to acquire these critical assets.",Could Have,13,"US-033, US-034, US-036","Given the Bank has only 2 houses remaining, and both the Human Player and an AI are eligible to build, when the Human Player confirms their intent to build, then the game identifies the shortage, and a building auction is initiated for the 2 available houses, one at a time.","Given a building auction is active and it is the Human Player's turn to bid, when the auction UI is presented, then the UI must clearly display the item being auctioned ('1 House'), the current high bid, and allow the player to 'Bid' or 'Pass'.","Given the user has set the 'Game Speed' to 'Fast' or 'Instant', when a building auction involving the Human Player is triggered, then the game speed must be temporarily set to 'Normal' for the duration of the auction, reverting after it concludes.",WI-302-002: Implement Building Shortage and Auction,"All acceptance criteria met. Building shortage auction is implemented and tested. UI is clear and functional. AI bidding logic is present. Game speed override is functional."
US-038,Property & Economic System,"Mortgage an undeveloped property to get cash","As a player managing my finances, I want to mortgage my undeveloped properties to the Bank, so that I can receive immediate cash to pay debts or fund purchases.",Must Have,3,"US-052, US-044","Given I am the active player and own an undeveloped and unmortgaged property, when I select the property and confirm the 'Mortgage' action, then my cash balance increases by the property's mortgage value, its state is updated to 'mortgaged', and the board/UI visually reflects this change.","Given I own a property with one or more houses on it, when I select the developed property in the Property Management interface, then the 'Mortgage' option is disabled, and a tooltip informs me that all buildings must be sold first.","Given I own a mortgaged property, when an opponent's token lands on that property space, then no rent transaction occurs.",WI-301-003: Implement Mortgaging and Unmortgaging,"All acceptance criteria met. Mortgaging transaction is implemented correctly. UI validation prevents mortgaging developed properties. Rent collection logic correctly skips mortgaged properties."
US-039,Property & Economic System,"Unmortgage a property by paying the principal plus 10% interest","As a Human Player managing my assets, I want to pay the bank to unmortgage one of my properties so that I can start collecting rent on it again and enable future development.",Must Have,3,"US-038, US-052, US-044","Given I own 'St. Charles Place' which is mortgaged (mortgage value $70), when I choose to unmortgage it for $77, and I have sufficient cash, then exactly $77 is deducted from my cash, the property's state is updated to 'unmortgaged', and its visual indicator returns to normal.","Given I own a mortgaged property and attempt to unmortgage it, but I have insufficient funds to cover the cost (principal + 10% interest), then the 'Unmortgage' button in the UI is disabled.","Given I have successfully unmortgaged 'St. Charles Place', when an opponent later lands on it, then rent is collected from them as normal.",WI-301-003: Implement Mortgaging and Unmortgaging,"All acceptance criteria met. Unmortgage calculation and transaction are correct. UI validation for insufficient funds is working. Rent collection is correctly re-enabled."
